row_id,boardgame,min_players,max_players,min_playtime,max_playtime,minimum_age,avg_rating,num_ratings,complexity,wishlisted,total_plays,amazon_price,categories,url,description
1481,Timeline: Inventions,2,8,15,15,8,6.697,8652,1.09,707,35105,,Card Game; Educational; Trivia,https://boardgamegeek.com/boardgame/85256/timeline-inventions,"Which was invented first, dynamite or the typewriter?"
1482,Agra,2,4,90,120,12,7.276,2539,4.34,975,5560,,Industry / Manufacturing,https://boardgamegeek.com/boardgame/230085/agra,Grow wealth and influence in India by leveraging the Emperor's birthday festivities.
1483,Santiago de Cuba,2,4,40,75,10,6.883,4682,2.15,713,13241,,Economic,https://boardgamegeek.com/boardgame/104347/santiago-de-cuba,Collect goods and meet the demand of those ever-present cargo ships.
1484,Edge of Darkness,1,4,120,120,14,7.472,2109,3.47,1371,6396,,Fantasy,https://boardgamegeek.com/boardgame/229491/edge-of-darkness,Draft and upgrade cards to defend the city from monstrous threats.
1485,Here to Slay,2,6,30,60,10,6.888,8128,1.67,1403,24100,20.0,Animals; Card Game; Dice; Fantasy; Fighting,https://boardgamegeek.com/boardgame/299252/here-to-slay,Powerful heroes band together to slay monsters for their abilities.
1486,Dungeon Twister,2,2,60,60,11,6.808,6110,2.88,1020,10318,,Adventure; Exploration; Fantasy; Fighting; Maze,https://boardgamegeek.com/boardgame/12995/dungeon-twister,Escape the dungeon or die trying in this head-to-head duel of wits.
1487,Deep Rock Galactic: The Board Game,1,4,60,150,12,8.13,1599,2.69,1509,5889,,Miniatures; Science Fiction; Video Game Theme,https://boardgamegeek.com/boardgame/348220/deep-rock-galactic-the-board-game,"Mine precious minerals, survive and fight aliens together on a foreign planet."
1488,BattleTech,2,4,0,0,12,7.096,3666,3.41,253,6641,,Collectible Components; Fighting; Miniatures; Science Fiction; Wargame,https://boardgamegeek.com/boardgame/1540/battletech,No description
1489,Oltréé,2,4,60,60,10,7.461,2228,2.24,1906,9239,,Adventure; Fantasy; Medieval,https://boardgamegeek.com/boardgame/293835/oltree,Rangers help local communities and defend their Kingdom in order to restore hope.
1490,Folklore: The Affliction,1,5,90,120,14,7.643,2240,3.68,1918,6438,,Adventure; Exploration; Fantasy; Horror; Miniatures,https://boardgamegeek.com/boardgame/159504/folklore-the-affliction,Scenario driven co-op adventure in a world of gothic horror.
1491,Carcassonne: Winter Edition,2,5,40,40,8,7.495,2052,1.78,454,7377,,Medieval; Territory Building,https://boardgamegeek.com/boardgame/131014/carcassonne-winter-edition,"Lay tiles to build roads, monasteries, cities & farms in a snowy medieval landscape."
1492,Saboteur,3,10,30,30,8,6.541,35137,1.32,2421,99328,12.99,Bluffing; Card Game; Deduction; Exploration; Fantasy; Party Game,https://boardgamegeek.com/boardgame/9220/saboteur,You are dwarves laying tunnel cards to get gold: but which one of you is the traitor?
1493,TransAmerica,2,6,30,30,13,6.69,8403,1.35,798,41879,32.91,Trains,https://boardgamegeek.com/boardgame/2842/transamerica,Connect your five cities across America on a shared rail network.
1494,Sentient,2,4,30,60,12,7.179,2754,2.2,1221,8061,,Dice; Industry / Manufacturing; Math; Science Fiction,https://boardgamegeek.com/boardgame/223855/sentient,Draft cards to manipulate your dice and collect investors for your technology.
1495,Unlock!: Exotic Adventures,1,6,60,90,10,7.285,2442,2.2,385,7341,36.99,Card Game; Exploration; Puzzle; Real-time,https://boardgamegeek.com/boardgame/254226/unlock-exotic-adventures,"Solve puzzles to escape the Boogeymen, Scheherazade's Last Tale, and the Challenger."
1496,Axis & Allies: Europe 1940,2,6,360,360,12,7.571,2414,3.49,569,2432,84.99,Economic; Wargame; World War II,https://boardgamegeek.com/boardgame/61692/axis-and-allies-europe-1940,"WWII conflict in European Theater with plastic troops, tanks, planes, and ships."
1497,Yukon Airways,1,4,60,90,14,7.316,2357,2.77,813,6434,,Aviation / Flight; Card Game; Dice; Transportation,https://boardgamegeek.com/boardgame/283294/yukon-airways,Deliver passengers while managing your fuel and making improvements to your seaplane.
1498,Mists over Carcassonne,1,5,35,35,8,7.295,2493,2.11,1326,29197,36.98,Medieval,https://boardgamegeek.com/boardgame/358124/mists-over-carcassonne,"Cooperatively lay tiles to keep the ghosts in check, but beware of haunted cemeteries"
1499,Kitchen Rush (Revised Edition),2,4,20,60,8,7.446,2082,2.13,843,14418,,Real-time,https://boardgamegeek.com/boardgame/287938/kitchen-rush-revised-edition,"Juggle orders, prepare dishes, and stock the pantry to satisfy your hungry customers."
1500,Coloma,1,6,60,90,14,7.307,2358,2.96,1268,5283,,American West; City Building,https://boardgamegeek.com/boardgame/264982/coloma,Strike it rich in the frontiers of California - will you boom or bust?
1501,Peloponnes,1,5,45,45,10,7.098,2974,2.37,965,11249,,Ancient; City Building; Civilization,https://boardgamegeek.com/boardgame/42910/peloponnes,"In ancient Greece, build up your population and power. Beware the disasters!"
1502,The Hunger,2,6,60,60,12,7.032,3763,2.31,1320,11190,,Card Game; Horror,https://boardgamegeek.com/boardgame/339906/the-hunger,"As a vampire, you want to hunt humans, but you must return home before sunrise..."
1503,Super-Skill Pinball: 4-Cade,1,4,30,30,12,7.048,3364,2.2,1003,15380,26.31,Dice,https://boardgamegeek.com/boardgame/302524/super-skill-pinball-4-cade,Roll dice and ricochet around a diverse series of thematic pinball tables.
1504,Coffee Rush,2,4,30,30,8,7.122,3629,1.81,1589,21278,39.94,Abstract Strategy,https://boardgamegeek.com/boardgame/377061/coffee-rush,Become the greatest barista by quickly fulfilling coffee and beverage orders.
1505,Pixies,2,5,30,30,8,7.096,3267,1.21,644,41612,17.99,Animals; Card Game; Number,https://boardgamegeek.com/boardgame/411875/pixies,"Choose the right card, place it in the right place, and keep an eye on your opponents"
1506,Critter Kitchen,1,5,60,60,12,7.883,1608,2.51,1702,5800,138.95,Animals,https://boardgamegeek.com/boardgame/393429/critter-kitchen,Gather ingredients to satisfy food challenges and impress a celebrity critic.
1507,Thunderbolt Apache Leader,1,1,90,90,12,8.028,1420,3.23,1086,3796,,Aviation / Flight; Modern Warfare; Wargame,https://boardgamegeek.com/boardgame/123955/thunderbolt-apache-leader,"Plan the missions, select the team & pray the pilots return successfully—or at all."
1508,Hacienda,2,5,60,90,10,6.915,4246,2.63,530,28077,,Animals; Economic; Farming; Territory Building,https://boardgamegeek.com/boardgame/19100/hacienda,"Become the savviest rancher, linking land & herds together before the deck runs out!"
1509,Machina Arcana (Second/Third Edition),1,4,150,150,13,7.897,1607,3.65,1204,4690,,Adventure; Dice; Exploration; Fighting; Horror; Mythology; Science Fiction,https://boardgamegeek.com/boardgame/299121/machina-arcana-secondthird-edition,A group of explorers are traveling the unknown while facing Lovecraftian horrors.
1510,Duelosaur Island,1,2,30,45,10,7.029,3508,2.36,738,8171,,Animals; Card Game; Dice; Science Fiction,https://boardgamegeek.com/boardgame/247236/duelosaur-island,Compete against your rival to build the most exciting dinosaur park in the world.
1511,System Gateway (fan expansion for Android: Netrunner),2,2,45,45,0,9.113,860,3.5,337,6777,,Bluffing; Card Game; Fan Expansion; Science Fiction; Third-party Expansion,https://boardgamegeek.com/boardgame/345976/system-gateway-fan-expansion-for-android-netrunner,"Set in a dystopian future, the race between Megacorporation and Netrunner continues."
1512,Nanty Narking,2,4,60,60,14,7.457,2098,2.32,995,5580,70.0,Bluffing; City Building; Deduction; Miniatures; Post-Napoleonic,https://boardgamegeek.com/boardgame/249746/nanty-narking,"Buy, bribe and murder your way to control of Victorian London's neighborhoods."
1513,A Game of Thrones: The Card Game,2,4,60,120,12,6.803,6340,3.25,470,23404,29.95,Card Game; Collectible Components; Fantasy; Fighting; Negotiation; Novel-based,https://boardgamegeek.com/boardgame/39953/a-game-of-thrones-the-card-game,Command Westeros' factions and plot your path to the Iron Throne.
1514,CloudAge,1,4,60,100,10,7.192,2742,2.84,1469,9362,58.45,Adventure; Aviation / Flight; Science Fiction,https://boardgamegeek.com/boardgame/316858/cloudage,"Travel in airships above dried-up landscapes, visit cities, and battle Cloud militia."
1515,Viceroy,1,4,45,60,13,6.784,5756,2.64,618,13864,29.0,Bluffing; Card Game; City Building; Civilization; Fantasy; Negotiation,https://boardgamegeek.com/boardgame/157526/viceroy,Bid your gems to recruit and build your pyramid of power!
1516,Hostage Negotiator,1,1,20,20,13,6.787,6183,2.06,1651,38457,28.82,Card Game; Dice,https://boardgamegeek.com/boardgame/134253/hostage-negotiator,Talk them down and save the hostages in this dice and card-driven solo game.
1517,Medina,3,4,60,60,10,7.027,3325,2.78,674,5204,,Abstract Strategy; Arabian; City Building; Post-Napoleonic,https://boardgamegeek.com/boardgame/1261/medina,"Collaboratively build a desert city of palaces, but claim the best ones for yourself."
1518,The Golden Ages,2,4,60,90,12,7.246,2471,2.89,627,5868,39.25,Civilization; Territory Building,https://boardgamegeek.com/boardgame/164338/the-golden-ages,Let your civilization grow till it reaches its Golden Age.
1519,Thunderbirds,1,4,45,60,10,7.522,2048,2.48,1126,6856,,Adventure; Movies / TV / Radio theme; Science Fiction,https://boardgamegeek.com/boardgame/160610/thunderbirds,"Never give in, at any cost! Coordinate your efforts to foil vile plots."
1520,Java,2,4,120,120,12,7.007,3518,3.38,834,3715,,City Building,https://boardgamegeek.com/boardgame/855/java,"As a Javanese ruler, become the dominant force in this underdeveloped area."
1521,Cartagena,2,5,45,45,8,6.683,8096,1.6,906,30444,19.24,Nautical; Pirates,https://boardgamegeek.com/boardgame/826/cartagena,Groups of pirates race to reach their ship and escape from Cartegena.
1522,Mission: Red Planet,3,5,60,60,10,6.878,4323,2.32,983,8017,,Science Fiction; Space Exploration,https://boardgamegeek.com/boardgame/18258/mission-red-planet,Take advantage of the passengers' special abilities to colonize Mars.
1523,Leviathan Wilds,1,4,45,90,10,7.923,1416,2.5,2792,7461,,Adventure; Card Game; Fantasy; Fighting; Video Game Theme,https://boardgamegeek.com/boardgame/358737/leviathan-wilds,Work together to remove binding crystals and heal the ailing leviathans.
1524,Level 7 [Omega Protocol],2,6,60,90,14,7.414,2181,3.17,1883,2894,,Fighting; Horror; Miniatures; Science Fiction,https://boardgamegeek.com/boardgame/137649/level-7-omega-protocol,Coordinate tactics with your squadmates in order to neutralize an alien threat.
1525,Ulm,2,4,45,75,10,7.011,3452,2.69,722,10083,20.0,Medieval; Renaissance,https://boardgamegeek.com/boardgame/191876/ulm,Use a 3x3 action grid to expand your influence in a medieval city under construction.
1526,Ticket to Ride: Germany,2,5,30,60,8,7.585,1919,1.73,690,6858,,Trains; Transportation,https://boardgamegeek.com/boardgame/225244/ticket-to-ride-germany,"Build routes, pick up passengers and score the most points."
1527,Deep Madness,1,6,60,120,16,7.804,2114,3.46,1407,4441,,Adventure; Fighting; Horror; Miniatures; Science Fiction,https://boardgamegeek.com/boardgame/202077/deep-madness,Escape from the deep-sea Kadath city before it gets devoured by otherworldly horrors.
1528,Ninjato,2,4,60,60,12,7.157,2751,2.76,859,6271,,Fighting; Medieval; Political,https://boardgamegeek.com/boardgame/50768/ninjato,"Ninjas raid noble homes to claim tools, techniques and allies. Who will dare to win?"
1529,Hellboy: The Board Game,1,4,60,90,14,7.741,2054,2.96,857,5190,79.95,Adventure; Comic Book / Strip; Exploration; Fighting; Horror; Miniatures,https://boardgamegeek.com/boardgame/243759/hellboy-the-board-game,Hellboy and friends punch and shoot their way through a variety of BRPD missions.
1530,Escape the Dark Castle,1,4,20,45,14,7.332,4099,1.21,2062,10674,44.95,Adventure; Card Game; Dice; Fantasy; Horror; Medieval,https://boardgamegeek.com/boardgame/227456/escape-the-dark-castle,"After years of wrongful incarceration, you embark on a desperate quest to escape..."
1531,The Captain Is Dead,2,7,60,90,14,7.053,3548,2.4,2029,9909,48.47,Fighting; Science Fiction,https://boardgamegeek.com/boardgame/159503/the-captain-is-dead,Aliens are attacking your spaceship! Work as a crew with unique skills to escape.
1532,Sobek: 2 Players,2,2,20,20,10,7.159,2819,1.93,1233,18294,34.94,Ancient; Economic,https://boardgamegeek.com/boardgame/332944/sobek-2-players,Pick the good tiles but beware of your opponent's possibilities.
1533,Fearsome Floors,2,7,60,60,10,6.669,8452,1.81,1117,24710,,Horror,https://boardgamegeek.com/boardgame/7805/fearsome-floors,"Here comes the monster. Be careful where you step, lest you become his latest victim."
1534,Trekking the World,2,5,30,60,10,7.051,3373,1.92,1153,11828,38.99,Educational; Environmental; Travel,https://boardgamegeek.com/boardgame/300442/trekking-the-world,A light strategy game about the pleasures and wonders of world travel.
1535,Townsfolk Tussle,1,5,40,200,14,7.703,1822,2.6,1937,5177,,Dice; Fantasy; Miniatures; Movies / TV / Radio theme,https://boardgamegeek.com/boardgame/312859/townsfolk-tussle,"In a vintage cartoon universe, work together to defend your town from pesky Ruffians."
1536,One Deck Dungeon: Forest of Shadows,1,2,30,45,14,7.082,3383,2.33,763,8478,21.98,Adventure; Card Game; Dice; Fantasy,https://boardgamegeek.com/boardgame/224821/one-deck-dungeon-forest-of-shadows,The dice-chucking dungeon delver gets poison.
1537,MicroMacro: Crime City – All In,1,4,15,45,12,7.823,1454,1.09,742,11541,25.17,Deduction; Humor; Murder / Mystery,https://boardgamegeek.com/boardgame/364766/micromacro-crime-city-all-in,Once more you solve murder cases in crime city.
1538,Rialto,2,5,45,45,10,6.897,4121,2.55,678,8855,,Political; Renaissance,https://boardgamegeek.com/boardgame/119591/rialto,Draft wisely & play your cards at the right moment to win bonuses and control Venice.
1539,Paint the Roses,2,5,50,70,11,7.19,2810,2.46,1781,13971,39.99,Deduction; Fantasy; Novel-based; Puzzle,https://boardgamegeek.com/boardgame/253759/paint-the-roses,Work together to finish the royal gardens by outsmarting the Queen of Hearts.
1540,Railroad Ink Challenge: Shining Yellow Edition,1,4,15,30,8,7.468,1897,2.04,397,9483,23.98,Dice; Trains,https://boardgamegeek.com/boardgame/306882/railroad-ink-challenge-shining-yellow-edition,Build a network of roads and rails in an arid landscape.
1541,Escape Room: The Game,3,5,60,60,16,6.881,4362,2.26,535,11648,43.95,Electronic; Puzzle,https://boardgamegeek.com/boardgame/204836/escape-room-the-game,Solve puzzles and use the keys to stop the chrono decoder to escape the room!
1542,Pickomino,2,7,20,20,8,6.596,12182,1.15,789,100018,,Animals; Dice,https://boardgamegeek.com/boardgame/15818/pickomino,"Roll those dice, push your luck and secure your stash of worms!"
1543,TEN,1,5,15,30,10,7.017,3448,1.45,818,19877,,Card Game,https://boardgamegeek.com/boardgame/335609/ten,An exciting push-your-luck and auction game for the whole family!
1544,New Angeles,4,6,120,240,14,7.049,3413,3.21,1382,4358,,Bluffing; Miniatures; Negotiation; Political; Science Fiction,https://boardgamegeek.com/boardgame/205716/new-angeles,"Play as corporations profiteering off crises, while negotiating to not lose it all."
1545,"The Hunters: German U-Boats at War, 1939-43",1,2,120,120,12,7.736,1830,2.54,1098,5222,129.95,Nautical; Wargame; World War II,https://boardgamegeek.com/boardgame/113873/the-hunters-german-u-boats-at-war-1939-43,"Sub captains have just three orders: run quiet, fire at will, and survive if you can."
1546,Zenith,2,4,25,35,12,7.952,1477,2.39,1086,12306,30.87,Card Game; Science Fiction,https://boardgamegeek.com/boardgame/424219/zenith,Players struggle to get control of the Solar System.
1547,burncycle,1,4,45,180,13,7.907,1462,4.06,1588,5526,,Dice; Exploration; Puzzle; Science Fiction; Spies / Secret Agents,https://boardgamegeek.com/boardgame/322656/burncycle,Robots use creative action sequencing to infiltrate corrupt human corporations.
1548,La Cosa Nostra,3,5,90,90,16,7.549,1946,2.61,527,3542,,Bluffing; Card Game; Mafia; Negotiation,https://boardgamegeek.com/boardgame/151771/la-cosa-nostra,"Mafiosos compete to turn the greatest profit, but watch out for rival gangs!"
1549,Rise of Tribes,2,4,30,60,10,7.077,3248,2.2,1032,8483,50.0,Civilization; Dice; Prehistoric,https://boardgamegeek.com/boardgame/202583/rise-of-tribes,Grow your tribe and conquer the new prehistoric land with your might and wit.
1550,Kahuna,2,2,30,40,10,6.612,10152,2.06,1309,22606,32.14,Abstract Strategy,https://boardgamegeek.com/boardgame/394/kahuna,Place your bridges and destroy your opponent's via card-play to control 12 islands.
1551,Guillotine,2,5,30,30,12,6.54,22068,1.27,1459,69688,,Age of Reason; Card Game; Humor,https://boardgamegeek.com/boardgame/116/guillotine,Manipulate the line to collect the most valuable heads.
1552,Foundations of Metropolis,2,4,60,60,14,7.681,1562,2.0,1860,4212,42.29,City Building; Economic,https://boardgamegeek.com/boardgame/412865/foundations-of-metropolis,Create the city of your dreams in this elegant and intuitive city-building game.
1553,Guildhall,2,4,30,45,10,6.883,4210,2.07,626,17144,,Card Game; Medieval,https://boardgamegeek.com/boardgame/132372/guildhall,"Ignite abilities of historians, dancers, assassins to fill chapters in your guildhall"
1554,Raising Robots,1,6,60,90,14,7.694,1667,3.21,1317,6686,49.95,Card Game,https://boardgamegeek.com/boardgame/366683/raising-robots,Compete against rival inventors to assemble the best team of robots.
1555,Renature,2,4,45,60,8,7.096,2922,2.21,1397,9163,19.9,Environmental,https://boardgamegeek.com/boardgame/300001/renature,Compete for the best ground as you restore a polluted valley with plants and animals.
1556,Trains: Rising Sun,2,4,45,45,12,7.433,1925,2.43,629,4081,,Card Game; Territory Building; Trains; Transportation,https://boardgamegeek.com/boardgame/157001/trains-rising-sun,A stand-alone expansion to build a dynamic rail system across Japan.
1557,Smash Up: It's Your Fault!,2,2,45,60,14,7.468,2082,2.0,518,1067,,Card Game; Fantasy; Horror; Humor; Medieval; Mythology; Science Fiction; Spies / Secret Agents; Zombies,https://boardgamegeek.com/boardgame/177802/smash-up-its-your-fault,The set YOU chose! Four factions decided on by the players.
1558,Evo,3,5,60,120,12,6.855,4512,2.34,631,6667,,Animals; Prehistoric; Science Fiction,https://boardgamegeek.com/boardgame/1159/evo,"Mutate dinosaurs to migrate, have babies, and fight—all before the meteor arrives!"
1559,Seas of Strife,3,6,45,45,10,7.331,2113,1.31,607,18900,16.97,American West; Card Game; Nautical,https://boardgamegeek.com/boardgame/225482/seas-of-strife,"Try to avoid taking tricks, but the suits are tricky in this game."
1560,Survive The Island,2,5,45,45,8,7.427,2214,1.45,1051,10236,28.99,Adventure; Fantasy; Mythology; Nautical,https://boardgamegeek.com/boardgame/425428/survive-the-island,"Avoid sharks, kaijus, and erupting volcanoes on your way to escape!"
1561,Ultimate Werewolf: Ultimate Edition,5,68,30,90,8,6.949,4188,1.49,773,21072,,Bluffing; Card Game; Deduction; Horror; Murder / Mystery; Negotiation; Party Game,https://boardgamegeek.com/boardgame/38159/ultimate-werewolf-ultimate-edition,Werewolves have descended upon your village! Who will survive?
1562,Kingdom Rush: Rift in Time,1,4,45,90,10,7.307,2461,2.98,906,11219,53.95,Adventure; Fantasy; Fighting; Medieval; Miniatures; Video Game Theme,https://boardgamegeek.com/boardgame/272533/kingdom-rush-rift-in-time,Defend the kingdom by arranging damage tiles on grids of attacking hordes.
1563,Sylvion,1,2,30,30,10,7.035,3322,2.07,1398,13731,25.99,Animals; Card Game; Environmental; Fantasy,https://boardgamegeek.com/boardgame/143405/sylvion,Stave off waves of an ever-hungry fire that wishes to ravage your beautiful forest.
1564,Trapwords,4,8,30,45,8,6.991,3551,1.43,973,9508,35.0,Exploration; Fantasy; Party Game; Word Game,https://boardgamegeek.com/boardgame/257527/trapwords,Navigate your way in the dungeon by explaining things without mentioning trapwords!
1565,Starship Captains,1,4,25,100,12,7.14,2790,2.37,1497,8051,,Science Fiction; Space Exploration,https://boardgamegeek.com/boardgame/363369/starship-captains,Take command of your crew to become the best starship captain in the galaxy.
1566,Disney Villainous: Despicable Plots,2,3,40,60,10,7.471,2130,2.19,878,1539,,Age of Reason; Card Game; Fantasy; Movies / TV / Radio theme; Mythology,https://boardgamegeek.com/boardgame/331050/disney-villainous-despicable-plots,The most despicable plot wins as these classic Disney villains face off.
1567,Keythedral,2,5,60,90,8,7.041,3047,2.85,779,4907,,City Building; Medieval,https://boardgamegeek.com/boardgame/4099/keythedral,Farmers go to work fields to collect the resources needed to build the Keythedral.
1568,UBOOT: The Board Game,1,4,30,120,12,7.552,2203,4.15,1798,3782,179.95,Miniatures; Nautical; Real-time; Wargame; World War II,https://boardgamegeek.com/boardgame/219100/uboot-the-board-game,"Man your U-boat (and survive!) through exciting app-based, real-time missions."
1569,Merchant of Venus,1,6,180,180,12,7.126,2799,2.83,874,6198,,Economic; Exploration; Science Fiction; Space Exploration; Transportation,https://boardgamegeek.com/boardgame/230/merchant-of-venus,Turn the biggest profit as you deliver goods across a mysterious star cluster.
1570,Stroganov,1,4,90,90,12,7.282,2317,3.31,946,6250,72.95,Exploration,https://boardgamegeek.com/boardgame/323156/stroganov,Explore the vast expanse of Siberia to gain wealth and fame.
1571,The Castles of Burgundy: The Dice Game,1,5,15,30,10,6.863,4303,1.89,815,31210,59.95,City Building; Dice; Economic; Medieval; Territory Building,https://boardgamegeek.com/boardgame/232988/the-castles-of-burgundy-the-dice-game,"Develop idyllic farmlands, castles and towns using placement and timing."
1572,Time's Up! Edición Amarilla,4,12,30,30,12,7.559,1737,1.08,147,8270,,Humor; Party Game,https://boardgamegeek.com/boardgame/38713/times-up-edicion-amarilla,"Describe Cleopatra in few seconds. Then try in one word, a gesture or a posture."
1573,Zombicide: Undead or Alive,1,6,60,60,14,7.996,1471,2.44,438,6890,104.98,American West; Fighting; Horror; Miniatures; Zombies,https://boardgamegeek.com/boardgame/331224/zombicide-undead-or-alive,Battle together to fight off zombies in the Old West... or die trying.
1574,Fleet: The Dice Game (Second Edition),1,4,30,45,8,7.764,1456,2.21,567,9278,,Dice; Nautical,https://boardgamegeek.com/boardgame/328326/fleet-the-dice-game-second-edition,Deploy your fleet of fishing boats while developing your bustling harbor.
1575,Walking in Burano,1,4,20,40,10,7.085,3014,1.97,747,10781,,Card Game; City Building; Travel,https://boardgamegeek.com/boardgame/257769/walking-in-burano,Balance the wants of locals and tourists alike by creating the best street in Burano.
1576,Planet Steam,2,5,90,180,14,7.091,2956,3.76,745,4707,,Economic; Industry / Manufacturing; Science Fiction,https://boardgamegeek.com/boardgame/23094/planet-steam,"In post apocalyptic planet, auctions and resource market to be the richest."
1577,Liberté,3,6,90,90,14,7.109,2771,3.31,755,4537,53.99,Napoleonic; Political,https://boardgamegeek.com/boardgame/2507/liberte,Manipulate your influence in 3 factions to win elections in the French Revolution.
1578,Mycelia,1,4,45,45,9,7.39,2207,1.89,1244,12586,21.98,Card Game,https://boardgamegeek.com/boardgame/392023/mycelia,Attract help from forest dwellers to remove dewdrops from your field.
1579,Sherlock Holmes Consulting Detective: Carlton House & Queen's Park,1,8,90,90,12,7.752,1516,2.26,1378,3847,55.98,Deduction; Murder / Mystery; Novel-based; Post-Napoleonic; Puzzle; Spies / Secret Agents,https://boardgamegeek.com/boardgame/223931/sherlock-holmes-consulting-detective-carlton-house,"Help Holmes investigate more cases, including several in the Carlton House mansion."
1580,Dungeon Degenerates: Hand of Doom,1,4,30,360,10,8.089,1523,3.65,1670,4424,,Adventure; Exploration; Fantasy,https://boardgamegeek.com/boardgame/210232/dungeon-degenerates-hand-of-doom,"The dark & dirty game of swords, sausages & sorcery."
1581,Lacuna,2,2,10,15,8,7.4,1970,1.07,1515,10364,31.99,Abstract Strategy,https://boardgamegeek.com/boardgame/386937/lacuna,Place your pawn between flowers of one kind to collect them and block your opponent.
1582,Dark Moon,3,7,60,75,12,6.972,3510,2.39,1629,9172,,Bluffing; Deduction; Dice; Movies / TV / Radio theme; Print & Play; Science Fiction; Space Exploration; Spies / Secret Agents,https://boardgamegeek.com/boardgame/111124/dark-moon,Who is Infected? Stay alive throughout the sabotage from the hidden traitor(s).
1583,Museum,2,4,30,60,12,7.153,2804,2.55,1454,7931,,Card Game,https://boardgamegeek.com/boardgame/204505/museum,Fill your own museum with relics from all over the World.
1584,The Rich and the Good,3,5,45,45,10,7.151,2608,2.15,967,6390,35.64,Economic,https://boardgamegeek.com/boardgame/38863/the-rich-and-the-good,Make wise investments using shared resources but don't forget to donate to charity!
1585,Turn the Tide,3,5,30,30,10,6.783,5146,1.52,723,16155,,Card Game; Nautical,https://boardgamegeek.com/boardgame/1403/turn-the-tide,"Keep outguessing your opponents to stay afloat, then repeat when playing their hands."
1586,Manhattan,2,4,45,45,10,6.728,5984,1.92,931,12221,,City Building,https://boardgamegeek.com/boardgame/199/manhattan,Contribute the most stories to the highest skyscrapers to win.
1587,Moon Colony Bloodbath,1,5,45,90,14,7.601,1660,2.14,2286,7126,46.02,Card Game; Science Fiction,https://boardgamegeek.com/boardgame/425549/moon-colony-bloodbath,Try to survive in this engine-building engine-losing tableau game.
1588,Come Sail Away!,1,4,25,25,10,7.762,1438,2.12,1327,7390,44.98,Nautical; Puzzle; Travel,https://boardgamegeek.com/boardgame/386405/come-sail-away,Are you able to board all your passengers before your ship sets sail?
