row_id,boardgame,min_players,max_players,min_playtime,max_playtime,minimum_age,avg_rating,num_ratings,complexity,wishlisted,total_plays,amazon_price,categories,url,description
1,Brass: Birmingham,2,4,60,120,14,8.575,53548,3.87,20334,152594,69.95,Age of Reason; Economic; Industry / Manufacturing; Post-Napoleonic; Trains; Transportation,https://boardgamegeek.com/boardgame/224517/brass-birmingham,"Build networks, grow industries, and navigate the world of the Industrial Revolution."
2,Pandemic Legacy: Season 1,2,4,60,60,13,8.512,56071,2.83,14478,301410,76.97,Environmental; Medical,https://boardgamegeek.com/boardgame/161936/pandemic-legacy-season-1,Mutating diseases are spreading around the world - can your team save humanity?
3,Ark Nova,1,4,90,150,14,8.539,54528,3.79,16121,528979,71.81,Animals; Card Game; Economic; Environmental,https://boardgamegeek.com/boardgame/342942/ark-nova,"Plan and build a modern, scientifically managed zoo to support conservation projects."
4,Gloomhaven,1,4,60,120,14,8.557,65443,3.92,21597,542336,,Adventure; Exploration; Fantasy; Fighting; Miniatures,https://boardgamegeek.com/boardgame/174430/gloomhaven,Vanquish monsters with strategic cardplay. Fulfill your quest to leave your legacy!
5,Twilight Imperium: Fourth Edition,3,6,240,480,14,8.572,26686,4.34,12449,49484,172.29,Civilization; Economic; Exploration; Negotiation; Political; Science Fiction; Space Exploration; Territory Building; Wargame,https://boardgamegeek.com/boardgame/233078/twilight-imperium-fourth-edition,"Build an intergalactic empire through trade, research, conquest and grand politics."
6,Dune: Imperium,1,4,60,120,14,8.418,53995,3.07,14792,210763,51.98,Movies / TV / Radio theme; Novel-based; Political; Science Fiction,https://boardgamegeek.com/boardgame/316554/dune-imperium,"Influence, intrigue, and combat in the universe of Dune."
7,Terraforming Mars,1,5,120,120,12,8.347,107994,3.27,25730,740148,79.99,Civilization; Economic; Environmental; Industry / Manufacturing; Science Fiction; Space Exploration; Territory Building,https://boardgamegeek.com/boardgame/167791/terraforming-mars,Compete with rival CEOs to make Mars habitable and build your corporate empire.
8,War of the Ring: Second Edition,2,4,150,240,13,8.548,23752,4.22,12412,42493,94.71,Fantasy; Fighting; Novel-based; Territory Building; Wargame,https://boardgamegeek.com/boardgame/115746/war-of-the-ring-second-edition,The Fellowship and the Free Peoples clash with Sauron over the fate of Middle-earth.
9,Star Wars: Rebellion,2,4,180,240,14,8.418,34995,3.75,14452,55353,109.99,Civil War; Movies / TV / Radio theme; Science Fiction; Space Exploration; Wargame,https://boardgamegeek.com/boardgame/187645/star-wars-rebellion,Strike from your hidden base as the Rebels—or find and destroy it as the Empire.
10,Dune: Imperium – Uprising,1,6,60,120,13,8.707,13487,3.51,6566,39729,56.4,Movies / TV / Radio theme; Novel-based; Science Fiction,https://boardgamegeek.com/boardgame/397598/dune-imperium-uprising,"Deploy agents, build your deck, and engage in strategic battles to control Arrakis."
11,Spirit Island,1,4,90,120,13,8.339,58873,4.08,23844,390307,64.99,Environmental; Fantasy; Mythology; Territory Building,https://boardgamegeek.com/boardgame/162886/spirit-island,Island Spirits join forces using elemental powers to defend their home from invaders.
12,Gloomhaven: Jaws of the Lion,1,4,30,120,14,8.382,38651,3.64,8865,194704,64.95,Adventure; Exploration; Fantasy; Fighting; Miniatures,https://boardgamegeek.com/boardgame/291457/gloomhaven-jaws-of-the-lion,Vanquish monsters with strategic cardplay in a 25-scenario Gloomhaven campaign.
13,Gaia Project,1,4,60,150,12,8.359,29894,4.4,12470,125607,,Civilization; Economic; Science Fiction; Space Exploration; Territory Building,https://boardgamegeek.com/boardgame/220308/gaia-project,"Expand, research, upgrade, and settle the galaxy with one of 14 alien species."
14,Twilight Struggle,2,2,120,180,13,8.235,50906,3.61,12794,133314,64.5,Modern Warfare; Political; Wargame,https://boardgamegeek.com/boardgame/12333/twilight-struggle,Relive the Cold War and rewrite history in an epic clash between the USA and USSR.
15,Through the Ages: A New Story of Civilization,2,4,120,120,14,8.261,33740,4.44,9899,144956,79.99,Card Game; Civilization; Economic,https://boardgamegeek.com/boardgame/182028/through-the-ages-a-new-story-of-civilization,Forge your own path through history as you draft a civilization for the ages.
16,The Castles of Burgundy,2,4,30,90,12,8.152,66796,2.97,13425,410557,399.99,Animals; Dice; Medieval; Territory Building,https://boardgamegeek.com/boardgame/84876/the-castles-of-burgundy,"Plan, trade, and build your Burgundian estate to prosperity and prominence."
17,Great Western Trail,2,4,75,150,12,8.163,42836,3.7,9971,153049,42.74,American West; Animals; Economic,https://boardgamegeek.com/boardgame/193738/great-western-trail,Use strategic outposts and navigate danger as you herd your cattle to Kansas City.
18,Eclipse: Second Dawn for the Galaxy,2,6,60,200,14,8.409,16024,3.65,8588,32784,225.0,Civilization; Exploration; Science Fiction; Space Exploration; Territory Building; Wargame,https://boardgamegeek.com/boardgame/246900/eclipse-second-dawn-for-the-galaxy,"Build an interstellar civilization by exploration, research, conquest, and diplomacy."
19,Scythe,1,5,90,115,14,8.115,89793,3.45,25439,328201,84.0,Economic; Fighting; Science Fiction; Territory Building,https://boardgamegeek.com/boardgame/169786/scythe,"Five factions vie for dominance in a war-torn, mech-filled, dieselpunk 1920s Europe."
20,Brass: Lancashire,2,4,60,120,14,8.198,26390,3.85,6241,80344,69.6,Economic; Educational; Industry / Manufacturing; Post-Napoleonic; Transportation,https://boardgamegeek.com/boardgame/28720/brass-lancashire,Test your economic mettle as you build and network in the Industrial Revolution.
21,7 Wonders Duel,2,2,30,30,10,8.084,103726,2.23,11713,604553,,Ancient; Card Game; City Building; Civilization; Economic,https://boardgamegeek.com/boardgame/173346/7-wonders-duel,Science? Military? What will you draft to win this head-to-head version of 7 Wonders?
22,Frosthaven,1,4,90,180,14,8.773,9036,4.41,6188,102087,198.95,Adventure; Exploration; Fantasy; Fighting; Miniatures,https://boardgamegeek.com/boardgame/295770/frosthaven,Adventure in the frozen north and build up your outpost throughout an epic campaign.
23,Nemesis,1,5,90,180,12,8.254,34821,3.48,14803,82874,138.63,Adventure; Horror; Miniatures; Science Fiction,https://boardgamegeek.com/boardgame/167355/nemesis,"Survive an alien-infested spaceship, but beware of other players and their agendas!"
24,Clank! Legacy: Acquisitions Incorporated,2,4,90,120,13,8.511,10679,2.74,6536,62938,100.0,Adventure; Fantasy,https://boardgamegeek.com/boardgame/266507/clank-legacy-acquisitions-incorporated,"""Go forth, be bold, and ACQUIRE!"" in this campaign version of ""Clank!"""
25,A Feast for Odin,1,4,30,120,12,8.166,31679,3.86,15786,123275,,Animals; Economic; Farming; Industry / Manufacturing; Medieval; Puzzle,https://boardgamegeek.com/boardgame/177736/a-feast-for-odin,"Puzzle together the life of a Viking village as you hunt, farm, craft, and explore."
26,Concordia,2,5,100,100,13,8.084,43420,2.99,12179,144417,52.47,Ancient; Economic; Nautical,https://boardgamegeek.com/boardgame/124361/concordia,Merchants build and trade throughout the Roman Empire to please the Gods.
27,Great Western Trail: Second Edition,1,4,75,150,12,8.284,16100,3.71,4971,59591,65.99,American West; Animals; Economic,https://boardgamegeek.com/boardgame/341169/great-western-trail-second-edition,Wrangle your herd of cows across the Midwest prairie and deliver it to Kansas City.
28,Lost Ruins of Arnak,1,4,30,120,12,8.071,51953,2.93,14978,285051,59.99,Adventure; Card Game; Exploration; Fantasy,https://boardgamegeek.com/boardgame/312484/lost-ruins-of-arnak,Explore an island to find resources and discover the lost ruins of Arnak.
29,Arkham Horror: The Card Game,1,2,60,120,14,8.126,46246,3.56,11164,347171,48.99,Adventure; Card Game; Collectible Components; Exploration; Horror; Novel-based,https://boardgamegeek.com/boardgame/205637/arkham-horror-the-card-game,Investigate the horrors of Arkham while courting cosmic doom.
30,Root,2,4,60,90,14,8.07,59387,3.83,22851,214776,47.2,Animals; Fantasy; Negotiation; Territory Building; Wargame,https://boardgamegeek.com/boardgame/237182/root,Decide the fate of the forest as woodland factions fight for contrasting goals.
31,The Lord of the Rings: Duel for Middle-earth,2,2,30,45,10,8.375,12887,2.06,5816,50401,39.99,Card Game; Fantasy; Novel-based,https://boardgamegeek.com/boardgame/421006/the-lord-of-the-rings-duel-for-middle-earth,Play as the Fellowship or Sauron and attempt to determine the fate of Middle-earth.
32,Too Many Bones,1,4,60,120,12,8.316,15886,3.87,12583,80318,154.8,Adventure; Dice; Fantasy; Fighting,https://boardgamegeek.com/boardgame/192135/too-many-bones,Toss gobs of unique dice in an epic adventure en route to a final boss showdown.
33,Terra Mystica,2,5,60,150,12,8.039,49937,3.98,14169,170491,79.7,Civilization; Economic; Fantasy; Territory Building,https://boardgamegeek.com/boardgame/120677/terra-mystica,Play fantastical factions. Expand your influence by terraforming and joining cults.
34,Sky Team,2,2,20,20,10,8.154,23570,2.04,9275,235694,30.19,Aviation / Flight; Dice,https://boardgamegeek.com/boardgame/373106/sky-team,Work together silently to land a plane under increasingly challenging circumstances.
35,Wingspan,1,5,40,70,10,8.014,105678,2.47,20695,768920,55.0,Animals; Card Game; Educational,https://boardgamegeek.com/boardgame/266192/wingspan,Attract a beautiful and diverse collection of birds to your wildlife preserve.
36,Orléans,2,5,90,90,12,8.048,34120,3.01,9237,115970,,Medieval; Religious; Travel,https://boardgamegeek.com/boardgame/164928/orleans,"Craftsmen, scholars & monks can help you reign supreme—but who will turn up to help?"
37,Slay the Spire: The Board Game,1,4,30,150,12,8.69,8131,2.91,7264,45535,113.59,Adventure; Card Game; Fantasy; Fighting; Video Game Theme,https://boardgamegeek.com/boardgame/338960/slay-the-spire-the-board-game,"Craft a unique deck, discover powerful relics, and Slay the Spire together!"
38,SETI: Search for Extraterrestrial Intelligence,1,4,40,160,14,8.395,11877,3.78,8241,41581,,Science Fiction; Space Exploration,https://boardgamegeek.com/boardgame/418059/seti-search-for-extraterrestrial-intelligence,Search for signs of alien life by launching probes and analyzing distant signals.
39,Mage Knight Board Game,1,4,60,240,14,8.08,34503,4.37,12716,79847,101.54,Adventure; Exploration; Fantasy; Fighting,https://boardgamegeek.com/boardgame/96848/mage-knight-board-game,"Build your hero’s spells, abilities, and artifacts as you explore & conquer cities."
40,Barrage,1,4,90,180,14,8.145,20213,4.12,7094,72799,199.99,Economic; Environmental; Industry / Manufacturing,https://boardgamegeek.com/boardgame/251247/barrage,Nations vie for hydroelectric dominance in a dystopia where water is power.
41,The Crew: Mission Deep Sea,2,5,20,20,10,8.081,22685,2.04,6384,272858,14.95,Adventure; Card Game; Mythology; Nautical,https://boardgamegeek.com/boardgame/324856/the-crew-mission-deep-sea,"Explore the deep sea, outwit fate, and discover the mythic land of Mu!"
42,Everdell,1,4,40,80,10,7.997,63498,2.83,22060,254249,,Animals; Card Game; City Building; Fantasy,https://boardgamegeek.com/boardgame/199792/everdell,Gather resources to develop a harmonious village of woodland critters and structures.
43,Viticulture Essential Edition,1,6,45,90,13,7.969,52887,2.89,13118,191305,52.0,Economic; Farming,https://boardgamegeek.com/boardgame/183394/viticulture-essential-edition,Create the most prosperous winery in Italy from the Tuscan vineyard you've inherited.
44,Hegemony: Lead Your Class to Victory,2,4,90,180,14,8.418,10200,4.23,6263,21437,75.04,Economic; Educational; Negotiation; Political,https://boardgamegeek.com/boardgame/321608/hegemony-lead-your-class-to-victory,"Simulate a whole contemporary nation in this asymmetric, politico-economic euro-game."
45,Heat: Pedal to the Metal,1,6,30,60,10,8.014,34442,2.2,13709,202523,60.0,Racing; Sports,https://boardgamegeek.com/boardgame/366013/heat-pedal-to-the-metal,"Push your car to the limit in the pursuit of victory, but don’t overheat!"
46,Marvel Champions: The Card Game,1,4,45,90,14,8.113,26377,2.95,6084,586345,48.99,Card Game; Collectible Components; Comic Book / Strip; Fighting,https://boardgamegeek.com/boardgame/285774/marvel-champions-the-card-game,Battle Marvel villains with unique teams of iconic heroes in this LCG.
47,Crokinole,2,4,30,30,8,8.055,20033,1.22,6710,240174,108.99,Action / Dexterity,https://boardgamegeek.com/boardgame/521/crokinole,Flick discs and make trick shots in this traditional Canadian dexterity game!
48,Kanban EV,1,4,60,180,14,8.39,9280,4.3,5935,23415,119.99,Economic; Industry / Manufacturing,https://boardgamegeek.com/boardgame/284378/kanban-ev,EV-factory workers optimize and innovate to stand out at the big board meeting.
49,Food Chain Magnate,2,5,120,240,14,8.042,22035,4.19,10444,56312,,Economic; Industry / Manufacturing,https://boardgamegeek.com/boardgame/175914/food-chain-magnate,Strategically hire and manage your workforce to outcompete rival fast food chains.
50,Underwater Cities,1,4,80,150,12,8.045,21742,3.58,8272,83875,59.43,Card Game; City Building; Industry / Manufacturing; Nautical; Science Fiction,https://boardgamegeek.com/boardgame/247763/underwater-cities,"Develop future cities on the seafloor through politics, production, and science."
51,Pax Pamir: Second Edition,1,5,45,120,13,8.141,16378,3.85,6638,66228,71.84,Economic; Educational; Negotiation; Political; Post-Napoleonic; Spies / Secret Agents,https://boardgamegeek.com/boardgame/256960/pax-pamir-second-edition,"Swing the tides of ""The Great Game"" as countries vie for control of Afghanistan."
52,Puerto Rico,3,5,90,150,12,7.903,73039,3.27,9942,203385,49.1,City Building; Economic; Farming,https://boardgamegeek.com/boardgame/3076/puerto-rico,"Ship goods, construct buildings, and choose roles that benefit you more than others."
53,Cthulhu: Death May Die,1,5,90,120,14,8.189,15461,2.49,7619,65624,,Fantasy; Fighting; Horror; Miniatures; Novel-based,https://boardgamegeek.com/boardgame/253344/cthulhu-death-may-die,Disrupt the ritual and slay the Elder Gods in this co-op dice chucker.
54,Cascadia,1,4,30,45,10,7.913,49310,1.85,14360,313960,37.77,Animals; Environmental,https://boardgamegeek.com/boardgame/295947/cascadia,Create the most harmonious ecosystem as you puzzle together habitats and wildlife.
55,On Mars,1,4,90,150,14,8.17,14075,4.63,8235,37172,111.99,City Building; Economic; Exploration; Science Fiction; Space Exploration; Territory Building,https://boardgamegeek.com/boardgame/184267/on-mars,"Be a part of the first Martian colony, striving to be the best contributor."
56,Pandemic Legacy: Season 0,2,4,45,60,14,8.355,8931,3.17,4083,65426,71.99,Medical; Spies / Secret Agents,https://boardgamegeek.com/boardgame/314040/pandemic-legacy-season-0,Work together during the Cold War to prevent a Soviet bio-threat.
57,Caverna: The Cave Farmers,1,7,30,210,12,7.931,36490,3.77,11841,91194,,Animals; Economic; Fantasy; Farming,https://boardgamegeek.com/boardgame/102794/caverna-the-cave-farmers,"From a simple cave, expand your dwarven home through mining, agriculture, and more."
58,Anachrony,1,4,30,120,15,8.053,20568,4.0,8691,54734,,Economic; Science Fiction,https://boardgamegeek.com/boardgame/185343/anachrony,Use Exosuits & time travel to ensure your vision for the future after the cataclysm.
59,Age of Innovation,1,5,40,200,14,8.519,7097,4.26,4068,23254,89.99,Civilization; Economic; Fantasy; Territory Building,https://boardgamegeek.com/boardgame/383179/age-of-innovation,Terraform the world to expand your faction and create innovations on the way.
60,Blood Rage,2,4,60,90,14,7.908,50172,2.88,13905,111089,89.99,Fantasy; Fighting; Mythology,https://boardgamegeek.com/boardgame/170216/blood-rage,Ragnarök has come! Secure your place in Valhalla in epic Viking battles.
61,Agricola,1,5,30,150,12,7.864,75296,3.63,12759,287734,57.19,Animals; Economic; Farming,https://boardgamegeek.com/boardgame/31260/agricola,Build your farmstead by sowing fields and raising livestock. But don't forget to eat!
62,Oathsworn: Into the Deepwood,1,4,30,90,14,8.822,6184,3.69,5920,36018,349.99,Adventure; Card Game; Dice; Exploration; Fantasy; Fighting; Miniatures; Mythology; Puzzle,https://boardgamegeek.com/boardgame/251661/oathsworn-into-the-deepwood,Fight for humanity's survival against unnatural horrors and the Deepwood itself.
63,Lisboa,1,4,60,120,12,8.174,12245,4.57,6563,31222,119.99,City Building; Economic; Industry / Manufacturing; Political,https://boardgamegeek.com/boardgame/161533/lisboa,Compete to reconstruct the city of Lisboa after the great earthquake of 1755.
64,Sleeping Gods,1,4,60,120,13,8.13,14625,3.25,16367,46850,82.95,Adventure; Exploration; Fantasy; Fighting; Nautical,https://boardgamegeek.com/boardgame/255984/sleeping-gods,"Voyages of the steamship ""Manticore"" and her crew on the Wandering Sea."
65,Obsession,1,4,30,90,14,8.091,16030,3.1,8544,86938,,Post-Napoleonic,https://boardgamegeek.com/boardgame/231733/obsession,"Renovate an estate, manage servants, and pursue romance in Victorian England."
66,Grand Austria Hotel,2,4,60,120,12,7.958,23513,3.2,6886,116284,58.99,Economic,https://boardgamegeek.com/boardgame/182874/grand-austria-hotel,Serve guests and prepare rooms to be the best hotelier in the Viennese modern age.
67,Pandemic Legacy: Season 2,2,4,60,60,14,8.019,17815,3.25,4775,128707,79.99,Environmental; Exploration; Medical; Science Fiction,https://boardgamegeek.com/boardgame/221107/pandemic-legacy-season-2,The world is a mystery after a devastating pandemic—where will your team go?
68,Clank!: Catacombs,2,4,45,90,13,8.25,10545,2.5,5632,40883,66.0,Adventure; Fantasy,https://boardgamegeek.com/boardgame/365717/clank-catacombs,Deck-building adventure meets tile-laying in the newest incarnation of Clank!
69,Mansions of Madness: Second Edition,1,5,120,180,14,7.925,38945,2.7,13456,100296,87.99,Adventure; Exploration; Fantasy; Fighting; Horror; Miniatures; Murder / Mystery; Mythology; Novel-based; Puzzle,https://boardgamegeek.com/boardgame/205059/mansions-of-madness-second-edition,Cling to your sanity as you investigate Lovecraftian horrors.
70,Tzolk'in: The Mayan Calendar,2,4,90,90,13,7.85,41310,3.66,9529,131173,59.95,Ancient; Civilization; Economic; Farming; Mythology,https://boardgamegeek.com/boardgame/126163/tzolkin-the-mayan-calendar,"Lead your people, build monuments and make offerings to earn the favour of the gods."
71,Power Grid,2,6,120,120,12,7.801,68031,3.25,12104,162101,41.57,Economic; Industry / Manufacturing,https://boardgamegeek.com/boardgame/2651/power-grid,"Bid, network, and manage resources in a race to supply the most cities with power."
72,Harmonies,1,4,30,45,10,8.026,19928,2.0,8135,195924,34.99,Abstract Strategy; Animals; Environmental,https://boardgamegeek.com/boardgame/414317/harmonies,Create your own landscape and habitats to welcome animals.
73,Quacks,2,4,45,45,10,7.808,55795,1.94,12458,278155,90.0,Fantasy; Medieval,https://boardgamegeek.com/boardgame/244521/quacks,"Pull ingredients from your stock to make your pot bubble, but hopefully not explode!"
74,Ticket to Ride Legacy: Legends of the West,2,5,20,90,10,8.669,5283,2.58,3587,61837,110.58,Trains,https://boardgamegeek.com/boardgame/390092/ticket-to-ride-legacy-legends-of-the-west,Build train lines across the United States in a twelve-game campaign.
75,Clans of Caledonia,1,4,30,120,12,7.935,21632,3.47,7316,78459,,Economic; Farming,https://boardgamegeek.com/boardgame/216132/clans-of-caledonia,"Lead your unique Scottish clan to economic might via production, trade, and export."
76,Paladins of the West Kingdom,1,4,90,120,12,7.964,19579,3.71,6224,59250,52.44,Medieval,https://boardgamegeek.com/boardgame/266810/paladins-of-the-west-kingdom,Invaders are coming from everywhere. Keep the faith and defend your homeland.
77,The Gallerist,1,4,60,150,13,8.012,15837,4.22,6646,38541,103.99,Economic,https://boardgamegeek.com/boardgame/125153/the-gallerist,"Amass a fortune, and stake your reputation by operating a lucrative art gallery."
78,Le Havre,1,5,30,150,12,7.838,33111,3.71,9953,89248,72.99,City Building; Economic; Industry / Manufacturing; Nautical,https://boardgamegeek.com/boardgame/35677/le-havre,"Establish a supply chain by collecting resources, building industries, and shipping."
79,Maracaibo,1,4,30,120,12,7.969,17965,3.91,6562,71304,73.74,Economic; Exploration; Nautical; Pirates,https://boardgamegeek.com/boardgame/276025/maracaibo,Seafarers journey to obtain wealth and fame in the 17th century Caribbean.
80,Star Wars: Imperial Assault,2,5,60,120,14,7.958,25476,3.3,7448,96859,89.97,Adventure; Exploration; Fighting; Miniatures; Movies / TV / Radio theme; Science Fiction; Wargame,https://boardgamegeek.com/boardgame/164153/star-wars-imperial-assault,Play as Rebel or Imperial forces to fulfill mission objectives.
81,Android: Netrunner,2,2,45,45,14,7.89,30934,3.41,5837,353165,,Bluffing; Card Game; Collectible Components; Science Fiction,https://boardgamegeek.com/boardgame/124742/android-netrunner,Megacorporation versus Netrunner in this futuristic cyberpunk game of cat and mouse.
82,The White Castle,1,4,80,80,12,7.994,17762,3.04,6505,100767,,Dice; Economic,https://boardgamegeek.com/boardgame/371942/the-white-castle,Become the most influential clan in Japan's Himeji stronghold.
83,Agricola (Revised Edition),1,4,30,120,12,7.955,20081,3.44,3920,66565,55.25,Animals; Economic; Farming,https://boardgamegeek.com/boardgame/200680/agricola-revised-edition,"Help your farm to prosper in this updated, streamlined edition of the acclaimed game."
84,Mechs vs. Minions,2,4,60,120,14,7.96,18015,2.46,8322,67984,,Fantasy; Fighting; Miniatures; Video Game Theme,https://boardgamegeek.com/boardgame/209010/mechs-vs-minions,Cooperatively program and pilot your mechs to defeat an army of marauding minions.
85,The Crew: The Quest for Planet Nine,2,5,20,20,10,7.771,46164,1.96,5952,620042,15.95,Card Game; Science Fiction; Space Exploration,https://boardgamegeek.com/boardgame/284083/the-crew-the-quest-for-planet-nine,Cooperate with your fellow astronauts as you explore the outer solar system.
86,Kingdom Death: Monster,1,4,60,180,17,8.479,10138,4.27,7352,56569,979.98,Adventure; Dice; Fantasy; Fighting; Horror; Mature / Adult; Miniatures; Mythology,https://boardgamegeek.com/boardgame/55690/kingdom-death-monster,Try to survive in a nightmarish world that lies under eternal darkness.
87,Blood on the Clocktower,6,21,30,120,15,8.371,8921,3.05,5944,103136,,Bluffing; Deduction; Murder / Mystery; Party Game,https://boardgamegeek.com/boardgame/240980/blood-on-the-clocktower,Deduce who the Demon is through logic and bluffing. Dead players still play.
88,Race for the Galaxy,2,4,30,60,12,7.739,57711,2.99,11309,761848,26.92,Card Game; Civilization; Economic; Science Fiction; Space Exploration,https://boardgamegeek.com/boardgame/28143/race-for-the-galaxy,"Worlds await! Colonize, develop and conquer, taking advantage of others' choices."
89,Great Western Trail: New Zealand,1,4,75,150,12,8.501,5701,4.0,2262,17510,59.99,Animals; Economic,https://boardgamegeek.com/boardgame/380607/great-western-trail-new-zealand,Tend to your sheep on the South Island of New Zealand.
90,Azul,2,4,30,45,8,7.726,101682,1.77,15351,817173,34.97,Abstract Strategy; Renaissance,https://boardgamegeek.com/boardgame/230802/azul,Artfully embellish the walls of your palace by drafting the most beautiful tiles.
91,Revive,1,4,90,120,14,8.098,10959,3.45,6289,47081,79.99,Civilization; Industry / Manufacturing; Science Fiction,https://boardgamegeek.com/boardgame/332772/revive,"Revive civilization, 5000 years after the fall of humankind."
92,Five Tribes: The Djinns of Naqala,2,4,40,80,13,7.767,43952,2.84,11403,137345,,Arabian; Fantasy; Mythology,https://boardgamegeek.com/boardgame/157354/five-tribes-the-djinns-of-naqala,"Move assassins, elders & builders through Naqala to claim oases & control djinns."
93,Darwin's Journey,1,4,60,120,14,8.116,10467,3.9,4691,43869,51.0,Exploration; Travel,https://boardgamegeek.com/boardgame/322289/darwins-journey,Retrace Darwin’s journey to the Galapagos in a worker-placement adventure.
94,Clank!: A Deck-Building Adventure,2,4,30,60,12,7.768,45619,2.23,12191,169240,,Adventure; Fantasy,https://boardgamegeek.com/boardgame/201808/clank-a-deck-building-adventure,Claim your treasures but don't attract the dragon in this deck-building dungeon race.
95,Fields of Arle,1,2,60,120,13,8.031,11925,3.85,6258,37500,84.99,Economic; Farming; Industry / Manufacturing,https://boardgamegeek.com/boardgame/159675/fields-of-arle,"Construct dikes, drain bogs, harvest flax and tend to newborn animals in East Frisia."
96,Wingspan Asia,1,2,40,70,10,8.236,8661,2.67,3403,25598,45.0,Animals; Economic; Educational,https://boardgamegeek.com/boardgame/366161/wingspan-asia,Travel to Asia to discover new birds for your wildlife preserve.
97,Eclipse: New Dawn for the Galaxy,2,6,60,180,14,7.822,28843,3.71,6825,55581,,Civilization; Fighting; Science Fiction; Space Exploration; Territory Building; Wargame,https://boardgamegeek.com/boardgame/72125/eclipse-new-dawn-for-the-galaxy,"Build an interstellar civilization by exploration, research, conquest, and diplomacy."
98,Aeon's End,1,4,60,60,14,7.876,22879,2.81,8407,130005,51.17,Card Game; Fantasy; Fighting; Science Fiction,https://boardgamegeek.com/boardgame/191189/aeons-end,Mages must reach their full potential to defend humanity from terrible monstrosities.
99,El Grande,2,5,60,120,12,7.765,31599,2.94,7400,63315,49.99,Medieval,https://boardgamegeek.com/boardgame/93/el-grande,"Use your caballeros to control regions of medieval Spain, keeping clear of the King!"
