row_id,boardgame,min_players,max_players,min_playtime,max_playtime,minimum_age,avg_rating,num_ratings,complexity,wishlisted,total_plays,amazon_price,categories,url,description
942,Clinic: Deluxe Edition,1,4,60,150,14,7.588,2981,4.0,1133,8170,74.99,City Building; Economic; Medical; Territory Building; Transportation,https://boardgamegeek.com/boardgame/272739/clinic-deluxe-edition,Treat patients for profit to build the city's most lucrative clinic.
943,Imperial Steam,2,4,120,120,12,7.756,2469,4.21,1142,6355,29.0,Economic; Industry / Manufacturing; Post-Napoleonic; Trains,https://boardgamegeek.com/boardgame/338760/imperial-steam,"Plan, build, and expand your railway network during the Industrial Age of Austria."
944,Battle for Rokugan,2,5,60,90,14,7.4,4081,2.74,1775,6481,,Fantasy; Medieval; Wargame,https://boardgamegeek.com/boardgame/234477/battle-for-rokugan,Misdirect your enemies and bluff your way to victory in order to honor your clan.
945,Black Sonata,1,1,30,30,12,7.472,3505,2.08,1889,15043,,Deduction; Print & Play; Renaissance,https://boardgamegeek.com/boardgame/231218/black-sonata,Search London to deduce the identity of a mysterious Shakespearean lady.
946,Hannibal & Hamilcar,2,2,40,200,12,8.278,1848,3.88,1170,2749,189.95,Ancient; Political; Wargame,https://boardgamegeek.com/boardgame/227460/hannibal-and-hamilcar,Recreate the struggle between Rome & Carthage in the 1st & 2nd Punic Wars.
947,Merchants Cove,1,4,60,90,14,7.408,3907,2.73,3169,12226,,Economic; Fantasy; Nautical,https://boardgamegeek.com/boardgame/277700/merchants-cove,Operate your own specialty goods shop with a unique set of components and mechanisms.
948,Panamax,2,4,90,120,12,7.301,4157,3.75,1479,8883,,Economic; Nautical; Transportation,https://boardgamegeek.com/boardgame/131287/panamax,Manage your shipping company to cargo-carrying success.
949,Celestia,2,6,30,30,8,6.925,12311,1.32,2561,53887,,Adventure; Aviation / Flight; Card Game; Fantasy,https://boardgamegeek.com/boardgame/175117/celestia,Players take turns as pilot and press their luck to win the greatest treasures!
950,Parade,2,6,45,45,8,7.006,8421,1.45,1756,47574,,Card Game; Novel-based; Number,https://boardgamegeek.com/boardgame/56692/parade,"Hold a parade for the Queen. In Wonderland, losing might be the best way to win."
951,Dale of Merchants,2,4,30,30,10,7.157,5945,2.09,1670,20237,,Animals; Card Game; Fantasy,https://boardgamegeek.com/boardgame/176165/dale-of-merchants,"Learn new techniques, trade goods, and manage your stock to build the master stall!"
952,Hoplomachus: Victorum,1,1,90,90,14,8.366,1729,3.53,1465,9365,,Dice; Fighting,https://boardgamegeek.com/boardgame/313889/hoplomachus-victorum,Strategic gladiator combat and adventure featuring solo campaign play.
953,King of New York,2,6,40,40,10,6.868,17086,1.87,2324,35315,99.94,Dice; Fighting; Movies / TV / Radio theme; Science Fiction,https://boardgamegeek.com/boardgame/160499/king-of-new-york,Monsters vie for fame or dominance over New York in this dice-rolling game.
954,Black Angel,1,4,60,120,12,7.202,5155,3.86,2234,12164,74.99,Science Fiction; Space Exploration,https://boardgamegeek.com/boardgame/230244/black-angel,Guide the Black Angel on an intergalactic voyage to find a new home for humanity.
955,Challengers!,1,8,45,45,8,7.082,7179,1.8,1880,63982,36.98,Animals; Card Game; Sports,https://boardgamegeek.com/boardgame/359970/challengers,Capture the flag and hold onto it to win the tournament!
956,Fugitive,2,2,5,20,10,7.142,5616,1.64,2350,27074,,Bluffing; Card Game; Deduction; Number; Spies / Secret Agents,https://boardgamegeek.com/boardgame/197443/fugitive,A quick card chase; will the fugitive escape or will the detective crack the case?
957,Morels,2,2,30,30,10,6.981,9872,1.74,2580,34494,26.95,Card Game; Educational,https://boardgamegeek.com/boardgame/122298/morels,"Walk through the woods, collect mushrooms, and cook them up for tasty points."
958,Squad Leader,2,2,60,60,14,7.561,3502,4.03,332,4549,,Wargame; World War II,https://boardgamegeek.com/boardgame/1035/squad-leader,Command squads of soldiers in tactical WWII combat.
959,Roam,2,4,30,45,8,7.284,4448,1.84,1445,19297,,Card Game; Fantasy,https://boardgamegeek.com/boardgame/267319/roam,Seek out and awaken the sleepwalking residents of Arzium.
960,Ohanami,2,4,20,20,8,7.278,4448,1.16,1363,32642,,Card Game; Number,https://boardgamegeek.com/boardgame/270314/ohanami,"Create the best Zen garden by harmonising water, vegetation, stones and sakura trees."
961,Terrorscape,2,4,30,45,14,8.167,2163,2.29,2277,9519,,Deduction; Dice; Fighting; Horror; Miniatures,https://boardgamegeek.com/boardgame/371433/terrorscape,Hide and Seek. Hunt and Escape. Killer and Prey!
962,Jambo,2,2,45,45,12,6.986,8411,2.07,1578,28789,,Card Game; Economic,https://boardgamegeek.com/boardgame/12002/jambo,African merchants go toe-to-toe to hawk their wares and earn the most gold.
963,Qwixx,2,5,15,15,8,6.874,14754,1.11,898,192361,12.55,Dice; Math; Number,https://boardgamegeek.com/boardgame/131260/qwixx,Use everyone's dice rolls to mark off numbers—but you can't go back once you pass.
964,The Duke,2,2,30,30,13,7.31,4257,2.48,1643,18477,,Abstract Strategy; Medieval,https://boardgamegeek.com/boardgame/36235/the-duke,"Draw, place, move and flip tiles to capture the enemy Duke."
965,Tang Garden,1,4,40,60,14,7.322,4400,2.62,2004,12235,,Environmental,https://boardgamegeek.com/boardgame/252153/tang-garden,Design and landscape a garden with majestic vistas gazed upon by noblemen.
966,Zombicide Season 2: Prison Outbreak,1,6,60,60,13,7.341,4831,2.67,714,6647,169.95,Horror; Miniatures; Zombies,https://boardgamegeek.com/boardgame/137988/zombicide-season-2-prison-outbreak,"Berzerkers, security zones, and prison cells complicate the zombie-killing mayhem."
967,Dungeons & Dragons: The Legend of Drizzt Board Game,1,5,60,60,12,7.199,6564,2.58,2076,11462,,Adventure; Exploration; Fantasy; Fighting; Miniatures; Novel-based,https://boardgamegeek.com/boardgame/91872/dungeons-and-dragons-the-legend-of-drizzt-board-ga,The dark elf Drizzt Do'Urden lurks deep within a monster-infested labyrinth maze.
968,Coffee Roaster,1,1,10,30,12,7.329,4006,2.18,2697,21951,40.24,Industry / Manufacturing,https://boardgamegeek.com/boardgame/196526/coffee-roaster,Brew the richest blends and score high in this solo puzzle.
969,Unlock!: Mystery Adventures,1,6,45,75,10,7.319,4025,2.09,501,10394,,Card Game; Exploration; Puzzle; Real-time,https://boardgamegeek.com/boardgame/228867/unlock-mystery-adventures,"Solve puzzles to escape a haunted house, a submarine, and search for pirate gold."
970,Stella: Dixit Universe,3,6,30,30,8,7.294,4281,1.16,1444,22921,31.9,Card Game; Party Game,https://boardgamegeek.com/boardgame/329845/stella-dixit-universe,Players confront each other with word-images association and risk management choices
971,One Deck Dungeon,1,2,30,45,14,6.939,12379,2.09,3550,56389,23.81,Card Game; Dice; Exploration; Fantasy; Print & Play,https://boardgamegeek.com/boardgame/179275/one-deck-dungeon,Level up your hero and descend deeper into the monster dungeon.
972,Dinosaur World,2,4,60,120,10,7.328,4289,3.27,1697,9098,38.47,Animals; City Building; Economic; Science Fiction,https://boardgamegeek.com/boardgame/317457/dinosaur-world,Delight visitors in a park populated by homegrown dinos. Safety waivers recommended!
973,Outlive,2,4,40,110,14,7.271,4842,3.04,2638,9468,,Science Fiction,https://boardgamegeek.com/boardgame/191051/outlive,"Place your apocalypse team to secure items, events, & resources then build a base."
974,Up Front,2,2,60,60,12,7.893,2302,3.42,866,8308,,Card Game; Wargame; World War II,https://boardgamegeek.com/boardgame/586/up-front,World War Two infantry card game based loosely on Squad Leader.
975,Pandemic: Rising Tide,2,5,45,45,8,7.541,3034,2.54,1126,10459,,Environmental,https://boardgamegeek.com/boardgame/234671/pandemic-rising-tide,Build dikes and pumps to protect the Netherlands from flooding by the North Sea.
976,Jekyll vs. Hyde,2,2,30,30,8,7.194,5052,1.85,1358,29591,16.32,Card Game; Novel-based,https://boardgamegeek.com/boardgame/297129/jekyll-vs-hyde,Will you maintain balance or give in to darkness in the battle of Hyde and Jekyll?
977,Among the Stars,2,4,30,30,12,7.019,7338,2.24,1857,16951,38.91,Card Game; City Building; Science Fiction,https://boardgamegeek.com/boardgame/110277/among-the-stars,"In a time of galactic peace, draft rooms to construct the best space station."
978,Lords of Xidit,3,5,90,90,14,7.076,6411,2.64,1052,12768,,Fantasy,https://boardgamegeek.com/boardgame/156566/lords-of-xidit,"Planning 6 moves ahead, recruit locals to help you defeat the invading monsters."
979,Shackleton Base: A Journey to the Moon,1,4,60,120,14,8.041,1949,3.78,2497,6379,82.3,Science Fiction; Space Exploration,https://boardgamegeek.com/boardgame/408180/shackleton-base-a-journey-to-the-moon,Lead your space agency to expand your presence on the Moon.
980,ZÈRTZ,2,2,30,60,9,7.268,4483,2.73,1060,16830,,Abstract Strategy,https://boardgamegeek.com/boardgame/528/zertz,Sacrifice pieces to your opponent in order to win this counterintuitive game.
981,Unlock!: Secret Adventures,1,6,60,60,10,7.509,3057,2.11,434,8260,29.59,Card Game; Exploration; Puzzle; Real-time,https://boardgamegeek.com/boardgame/239307/unlock-secret-adventures,"Solve puzzles to escape a madman, journey to Oz, and protect a train."
982,Guards of Atlantis II,4,10,90,120,14,8.428,1686,3.35,1113,8409,,Fantasy; Miniatures; Video Game Theme; Wargame,https://boardgamegeek.com/boardgame/267609/guards-of-atlantis-ii,Card-driven Team-vs-Team Battle Arena with a lot of depth and no randomness.
983,The Lost Expedition,1,5,30,50,14,7.038,7715,1.87,2424,32774,21.0,Adventure; Card Game; Exploration,https://boardgamegeek.com/boardgame/216459/the-lost-expedition,Lead your intrepid explorers deep into the deadly jungle in your quest for El Dorado.
984,Beast,2,4,60,120,14,7.474,3808,3.05,2735,8400,49.99,Deduction; Fantasy; Fighting; Horror,https://boardgamegeek.com/boardgame/281549/beast,Hunters cooperate to track and take down ancient Beasts threatening their settlements
985,Mahjong,3,4,120,120,8,7.058,7965,2.58,647,38894,,Abstract Strategy,https://boardgamegeek.com/boardgame/2093/mahjong,"Use the Winds, Dragons and suit tiles you draw to finish with the best hand!"
986,Werewords,4,10,10,10,8,7.111,5849,1.16,1169,65545,17.94,Deduction; Party Game; Real-time; Word Game,https://boardgamegeek.com/boardgame/219215/werewords,20 questions with a twist... a time limit and a sneaky werewolf who knows the answer!
987,Arcadia Quest: Inferno,2,4,60,120,13,7.859,2450,2.46,633,5337,112.31,Adventure; Fantasy; Fighting; Miniatures,https://boardgamegeek.com/boardgame/179803/arcadia-quest-inferno,Arcadia was dragged down into Inferno. Save it and rescue angels from the Underlord!
988,1989: Dawn of Freedom,2,2,150,150,12,7.758,2432,3.29,1118,4868,56.88,Modern Warfare; Political; Wargame,https://boardgamegeek.com/boardgame/26997/1989-dawn-of-freedom,A game of political struggle as the Soviet Empire begins to show cracks.
989,XCOM: The Board Game,1,4,60,120,14,6.983,9306,2.91,2541,17559,,Real-time; Science Fiction; Video Game Theme,https://boardgamegeek.com/boardgame/163602/xcom-the-board-game,Quickly work together to develop new tech and defend the world from invading aliens.
990,Forbidden Island,2,4,30,30,10,6.754,53127,1.74,5114,130707,20.99,Adventure; Fantasy; Science Fiction,https://boardgamegeek.com/boardgame/65244/forbidden-island,You and your fellow adventurers try to make it out alive before the island sinks.
991,Tribune: Primus Inter Pares,2,5,60,120,12,7.211,4720,2.87,840,10525,,Ancient; Political,https://boardgamegeek.com/boardgame/30957/tribune-primus-inter-pares,Fight for control over the ruling factions of Rome in this game of intrigue!
992,Caylus 1303,2,5,60,90,12,7.422,3506,2.87,1219,7130,29.67,City Building; Economic; Medieval,https://boardgamegeek.com/boardgame/284818/caylus-1303,Quarrelsome master builders compete for supplies and specialists to impress the King.
993,Star Wars: The Card Game,2,2,30,60,10,7.176,5872,2.97,859,35114,74.98,Card Game; Collectible Components; Movies / TV / Radio theme; Science Fiction,https://boardgamegeek.com/boardgame/103886/star-wars-the-card-game,Unique deckbuilding and tense battles with a bluffing component.
994,Friedrich: Anniversary Edition,3,4,210,210,12,7.555,3005,3.13,1194,5597,,Age of Reason; Wargame,https://boardgamegeek.com/boardgame/12891/friedrich-anniversary-edition,Europe is on a knife's edge as Prussia faces down an uneasy alliance.
995,Luxor,2,4,45,45,8,7.199,5023,1.91,1339,31360,60.77,Adventure; Ancient,https://boardgamegeek.com/boardgame/245643/luxor,It's a race to the tomb as you control a team of loot grabbing archaeologists!
996,Rurik: Dawn of Kiev,1,4,60,120,13,7.683,2688,3.08,1723,5357,,Medieval; Miniatures; Territory Building,https://boardgamegeek.com/boardgame/228328/rurik-dawn-of-kiev,"Claim your father's throne! Build, tax, & fight through unique “auction programming.”"
997,Rhino Hero,2,5,5,15,5,6.895,11868,1.02,1385,71429,14.99,Action / Dexterity; Animals; Card Game; Children's Game; Party Game,https://boardgamegeek.com/boardgame/91514/rhino-hero,Build a giant tower and try to make your opponent be the one to let it collapse.
998,Rats of Wistar,1,4,90,90,13,7.511,3132,3.39,2054,15082,96.36,Animals,https://boardgamegeek.com/boardgame/387780/rats-of-wistar,Intelligent rats explore their new house and expand their lair.
999,Vasco da Gama,2,4,60,120,12,7.21,4631,3.23,861,8533,119.0,Nautical; Renaissance,https://boardgamegeek.com/boardgame/41002/vasco-da-gama,Plan your day in a non-linear manner to launch ships but beware of changing tides!
1000,Spyrium,2,5,75,75,12,7.041,6441,2.9,1040,15095,99.99,City Building; Economic; Industry / Manufacturing; Science Fiction,https://boardgamegeek.com/boardgame/137269/spyrium,A unique worker-placement game set in a steampunk world.
1001,Las Vegas Royale,2,5,45,60,8,7.47,3211,1.44,1637,13058,82.25,Dice,https://boardgamegeek.com/boardgame/271319/las-vegas-royale,"Las Vegas gets a make over, adding some new incentives to the classic dice game."
1002,Scoville,2,6,60,90,13,7.111,5593,2.78,1306,14098,,Farming,https://boardgamegeek.com/boardgame/145659/scoville,"Plant, cross-breed, harvest, and sell or cook your peppers to win the Chili Festival!"
1003,Reef Encounter,2,4,60,120,10,7.125,5257,3.68,1319,15216,,Animals; Environmental; Territory Building,https://boardgamegeek.com/boardgame/12962/reef-encounter,Polyps grow into corals and fight for control of the reefs.
1004,Container,3,5,60,90,12,7.165,4942,3.24,2082,10771,,Economic; Industry / Manufacturing; Nautical; Transportation,https://boardgamegeek.com/boardgame/26990/container,Players drive prices as they produce and ship goods in this economic simulation.
1005,Star Trek: Fleet Captains,2,4,90,120,14,7.467,3382,3.06,1694,6000,129.99,Fighting; Movies / TV / Radio theme; Science Fiction; Space Exploration,https://boardgamegeek.com/boardgame/79127/star-trek-fleet-captains,Federation and Klingon fleets complete missions throughout the galaxy for dominance.
1006,Nightmare Productions,2,5,60,60,10,7.067,5947,2.1,1520,13976,41.86,Movies / TV / Radio theme,https://boardgamegeek.com/boardgame/904/nightmare-productions,"Make the best (and worst!) horror films, bidding on directors, creatures, and more."
1007,Sleeping Gods: Distant Skies,1,4,60,600,13,8.437,1555,2.96,2674,5796,84.93,Adventure; Aviation / Flight; Exploration; Fantasy; Fighting,https://boardgamegeek.com/boardgame/358320/sleeping-gods-distant-skies,Journey across a rugged landscape in this sequel to Sleeping Gods.
1008,Kingdom Legacy: Feudal Kingdom,1,1,360,480,14,8.201,1731,2.22,1057,14515,16.0,Adventure; Card Game; City Building; Civilization; Economic; Exploration; Medieval,https://boardgamegeek.com/boardgame/415776/kingdom-legacy-feudal-kingdom,"A six hour solo campaign for adventurous, strategic minds."
1009,Washington's War,2,2,90,90,0,7.604,2708,2.88,1127,5969,73.97,Age of Reason; American Revolutionary War; Wargame,https://boardgamegeek.com/boardgame/38996/washingtons-war,Classic card-driven game. Free the Patriots or keep America in the British Empire.
1010,Palm Island,1,2,15,15,10,7.066,6769,1.75,1809,59512,24.99,Card Game; City Building; Print & Play,https://boardgamegeek.com/boardgame/239464/palm-island,Develop and gather resources to grow an island that fits in the palm of your hand.
1011,Stardew Valley: The Board Game,1,4,45,200,13,7.412,4301,2.76,3588,10781,74.16,Animals; Farming; Video Game Theme,https://boardgamegeek.com/boardgame/332290/stardew-valley-the-board-game,"Build your farm, grow crops, and explore Stardew Valley!"
1012,"13 Days: The Cuban Missile Crisis, 1962",2,2,45,45,10,7.199,4631,2.33,1174,13226,,Bluffing; Modern Warfare; Political; Wargame,https://boardgamegeek.com/boardgame/177590/13-days-the-cuban-missile-crisis-1962,USA and USSR seek world domination - but too much aggression triggers nuclear war.
1013,Zombicide: Invader,1,6,60,60,14,7.753,2855,2.35,802,9435,199.95,Fighting; Miniatures; Science Fiction; Zombies,https://boardgamegeek.com/boardgame/248065/zombicide-invader,Guide survivors to complete their objectives while defending against waves of aliens.
1014,Combat Commander: Pacific,2,2,180,180,12,8.106,1792,3.25,965,4751,,Wargame; World War II,https://boardgamegeek.com/boardgame/28181/combat-commander-pacific,Recreate the Pacific theater of World War II in this acclaimed card-driven wargame.
1015,Roll Through the Ages: The Bronze Age,1,4,30,45,8,6.845,12270,1.78,1548,79471,,Ancient; City Building; Civilization; Dice,https://boardgamegeek.com/boardgame/37380/roll-through-the-ages-the-bronze-age,Roll and Civilize your way to victory with an ancient Mediterranean empire.
1016,Hyperborea,2,6,50,150,14,7.164,5084,3.16,1278,10366,74.99,Civilization; Exploration; Fantasy; Fighting,https://boardgamegeek.com/boardgame/119788/hyperborea,"Compete to collect the riches of a long-lost, magical society."
1017,Red Rising,1,6,45,60,14,6.973,9078,2.32,1898,37212,49.95,Card Game; Novel-based; Science Fiction,https://boardgamegeek.com/boardgame/329465/red-rising,Craft a hand of powerful characters from the dystopian world of Red Rising.
1018,Everdell Farshore,1,4,40,80,10,7.862,2265,2.85,2011,7022,75.5,Animals; Card Game; City Building; Fantasy,https://boardgamegeek.com/boardgame/394106/everdell-farshore,"Visit the docks, gather seastones, and prepare for the winds of change!"
1019,Thunderstone,1,5,60,60,12,6.904,10665,2.5,1432,40618,,Card Game; Fantasy; Fighting,https://boardgamegeek.com/boardgame/53953/thunderstone,Adventurers gain power slaying foes. Can you defeat the guardian of the Thunderstone?
1020,Carcassonne: The City,2,4,30,45,8,7.208,4558,2.27,1354,7591,,City Building; Medieval,https://boardgamegeek.com/boardgame/12902/carcassonne-the-city,"Lay tiles to build homes, streets, and markets; then add wooden walls and towers."
1021,Ca$h 'n Guns: Second Edition,4,8,30,30,10,6.813,16129,1.25,2458,37805,39.99,Bluffing; Fighting; Humor; Mafia; Negotiation; Party Game,https://boardgamegeek.com/boardgame/155362/ca-dollar-h-n-guns-second-edition,A band of gangsters splits its loot — but guns speak louder than money.
1022,Yedo,2,5,120,180,14,7.332,3902,3.33,1382,7941,,Medieval,https://boardgamegeek.com/boardgame/117915/yedo,Sabotage rival clans by completing cloak-and-dagger missions in the city of Yedo.
1023,Istanbul: The Dice Game,2,4,20,40,8,7.144,5164,1.8,779,29491,,Dice,https://boardgamegeek.com/boardgame/235488/istanbul-the-dice-game,Roll worker dice to collect and trade resources to acquire shiny rubies!
1024,Captain Flip,2,5,20,20,8,7.135,5382,1.19,1730,121903,48.47,Nautical; Pirates,https://boardgamegeek.com/boardgame/393325/captain-flip,"Hoist your flag, recruit a colorful crew, and earn as many gold coins as you can."
1025,DinoGenics,1,5,90,120,14,7.577,2762,2.93,1561,10136,,Science Fiction; Territory Building,https://boardgamegeek.com/boardgame/210296/dinogenics,Build and manage your own dinosaur island resort.
1026,Condottiere,2,6,20,45,10,6.887,10626,1.95,2119,25280,,Bluffing; Card Game; Medieval; Negotiation,https://boardgamegeek.com/boardgame/112/condottiere,Manage and deploy your mercenaries to the right province to take control over Italy!
1027,Last Night on Earth: The Zombie Game,2,6,60,90,12,6.9,14260,2.3,2347,31590,50.89,Fighting; Horror; Miniatures; Zombies,https://boardgamegeek.com/boardgame/29368/last-night-on-earth-the-zombie-game,A handful of survivors aim to survive the night against the zombie horde.
1028,Tiny Epic Dinosaurs,1,4,30,60,14,7.293,4011,2.62,1090,9974,29.52,Animals; Fantasy; Farming; Science Fiction,https://boardgamegeek.com/boardgame/291508/tiny-epic-dinosaurs,Become dino ranchers in the lucrative dinosaur farming industry.
1029,Formula Dé,2,10,120,120,10,6.993,7977,1.96,485,18610,53.48,Racing; Sports,https://boardgamegeek.com/boardgame/173/formula-de,Use custom dice to race on Formula 1 courses.
1030,San Marco,3,4,75,75,10,7.172,4629,2.68,975,7833,,Medieval; Political,https://boardgamegeek.com/boardgame/1041/san-marco,"Control Venice! You divide the cards, but another player chooses who gets which set."
1031,Akrotiri,2,2,45,45,13,7.158,4913,2.64,2178,11309,,Ancient; Civilization; Economic; Exploration; Transportation,https://boardgamegeek.com/boardgame/154458/akrotiri,"Explore the Aegean Sea, connect trade routes, and discover temples by placing tiles."
1032,Catacombs (Third Edition),2,5,60,90,14,7.457,3151,2.39,2334,5231,,Action / Dexterity; Adventure; Fantasy; Fighting,https://boardgamegeek.com/boardgame/195137/catacombs-third-edition,Flick down the door and slay monsters in this dexterity-based dungeon delve!
1033,Union Pacific,2,6,90,90,12,7.196,4382,2.55,654,9865,,Economic; Trains,https://boardgamegeek.com/boardgame/94/union-pacific,Will you increase the value of railways you have a stake in or fight for more shares?
1034,The Thing: The Boardgame,1,8,60,90,14,7.639,2862,2.98,1712,7927,,Deduction; Horror; Movies / TV / Radio theme; Science Fiction,https://boardgamegeek.com/boardgame/295293/the-thing-the-boardgame,Your team tries to evacuate an Antarctic base as an alien lurks amongst you.
1035,Qwirkle,2,4,45,45,6,6.776,21481,1.58,1745,99773,23.99,Abstract Strategy,https://boardgamegeek.com/boardgame/25669/qwirkle,Complete a set of shapes or colors among the criss-crossing tiles for big points!
1036,Spyfall,3,8,15,15,13,6.75,22064,1.23,3021,109223,33.53,Bluffing; Deduction; Humor; Party Game; Spies / Secret Agents,https://boardgamegeek.com/boardgame/166384/spyfall,Players ask each other probing questions to detect the Spy.
1037,Jaws,2,4,60,60,12,7.071,6681,2.15,1397,10868,42.41,Animals; Fighting; Movies / TV / Radio theme; Nautical,https://boardgamegeek.com/boardgame/272738/jaws,Hunt down the killer shark terrorizing Amity Island. Then battle it out on the Orca.
1038,Botanik,2,2,30,30,12,7.523,2918,1.76,1315,20233,,Abstract Strategy,https://boardgamegeek.com/boardgame/271529/botanik,Build the best steampunk garden by winning the tiles you need.
1039,Pictomania,3,6,25,25,9,7.257,3974,1.52,946,12677,,Party Game; Real-time,https://boardgamegeek.com/boardgame/98229/pictomania,Pictionary chaos. Everyone draws and guesses at the same time.
1040,Tak,2,2,20,60,12,7.569,3055,2.44,2061,20806,,Abstract Strategy,https://boardgamegeek.com/boardgame/197405/tak,Be first to build a complete road using tiles that can stack or stand on edge.
1041,MLEM: Space Agency,2,5,30,60,8,7.177,4831,1.7,1672,27509,32.99,Animals; Dice; Space Exploration,https://boardgamegeek.com/boardgame/387378/mlem-space-agency,Send your cats throughout the solar system to occupy planets and moons.
1042,The Mind,2,4,20,20,8,6.734,35217,1.08,3337,200428,13.49,Card Game; Number,https://boardgamegeek.com/boardgame/244992/the-mind,Play your cards in ascending order without communicating. Timing is key!
1043,The Wolves,2,5,75,75,14,7.267,4242,2.81,2322,13788,89.95,Animals; Territory Building,https://boardgamegeek.com/boardgame/368058/the-wolves,Establish your pack of wolves' dominance over the course of a moon cycle!
1044,Horrified: American Monsters,1,5,60,60,10,7.447,3350,2.18,1386,7877,39.99,Horror,https://boardgamegeek.com/boardgame/343562/horrified-american-monsters,Monsters from American folklore terrorize the nation. Can your team stop them?
1045,Call to Adventure,1,4,30,60,13,7.061,6807,2.01,2071,18208,39.92,Card Game; Fantasy; Novel-based,https://boardgamegeek.com/boardgame/238992/call-to-adventure,"Hero or Foe? You decide in this tile chucking, character building game."
1046,Unmatched: Houdini vs. The Genie,2,2,20,20,9,8.229,1719,2.28,536,2630,,Card Game; Fantasy; Fighting; Mythology; Novel-based,https://boardgamegeek.com/boardgame/354544/unmatched-houdini-vs-the-genie,Two magicians from history and legend join the fray!
1047,Lanterns: The Harvest Festival,2,4,30,30,8,6.861,11801,1.55,2116,42197,31.2,Abstract Strategy,https://boardgamegeek.com/boardgame/160851/lanterns-the-harvest-festival,Decorate the lake with floating lanterns and dedicate your cards to gain honour!
1048,River of Gold,2,4,60,90,14,7.561,2720,2.43,2078,12605,,Economic; Fantasy; Travel,https://boardgamegeek.com/boardgame/399941/river-of-gold,A game of rivals and riches set on the legendary river of Rokugan.
1049,Kingsburg (Second Edition),2,5,90,120,10,7.378,3379,2.44,1131,7488,,City Building; Dice; Fantasy; Medieval,https://boardgamegeek.com/boardgame/199966/kingsburg-second-edition,Influence members of the King's court to grow your province and prepare for battle.
1050,The Palaces of Carrara,2,4,60,60,10,7.118,4889,2.59,1094,16531,,City Building; Economic; Renaissance,https://boardgamegeek.com/boardgame/129948/the-palaces-of-carrara,"Buy marble to erect beautiful buildings, but score them quickly before the game ends!"
